,Location,loc,point,lat,lon,altitude
1383,"LOMBOK TIMUR,NUSA TENGGARA BARAT","Lombok Timur, Nusa Tenggara Barat, 83659, Indonesia","(-8.6330934, 116.5587704, 0.0)",-8.6330934,116.5587704,0.0
1384,"KOTA BANJARBARU,KALIMANTAN SELATAN","Banjarbaru, Kalimantan Selatan, Indonesia","(-3.4472241, 114.7811303, 0.0)",-3.4472241,114.7811303,0.0
1385,"TAPIN,KALIMANTAN SELATAN","Tapin, Kalimantan Selatan, Indonesia","(-2.8622729500000004, 115.01096398201116, 0.0)",-2.8622729500000004,115.01096398201116,0.0
1386,"CIREBON,JAWA BARAT","Cirebon, Jawa Barat, 45121, Indonesia","(-6.7137044, 108.5608483, 0.0)",-6.7137044,108.5608483,0.0
1387,"PINRANG,SULAWESI SELATAN","Pinrang, Sulawesi Selatan, 91211, Indonesia","(-3.7932568, 119.6528692, 0.0)",-3.7932568,119.6528692,0.0
1388,"BANYUMAS,JAWA TENGAH","Banyumas, Jawa Tengah, Indonesia","(-7.45507165, 109.11674648495966, 0.0)",-7.45507165,109.11674648495966,0.0
1389,"BIMA,NUSA TENGGARA BARAT","Kabupaten Bima, Nusa Tenggara Barat, 84171, Indonesia","(-8.5637593, 118.6719665, 0.0)",-8.5637593,118.6719665,0.0
1390,"PEMALANG,JAWA TENGAH","Pemalang, Jawa Tengah, 52361, Indonesia","(-6.8903574, 109.3806499, 0.0)",-6.8903574,109.3806499,0.0
1391,"PINRANG,SULAWESI SELATAN","Pinrang, Sulawesi Selatan, 91211, Indonesia","(-3.7932568, 119.6528692, 0.0)",-3.7932568,119.6528692,0.0
1392,"ACEH SINGKIL,ACEH","Aceh Singkil, Aceh, Indonesia","(2.37587935, 97.92442948748499, 0.0)",2.37587935,97.92442948748499,0.0
1393,"KOTA BANDUNG,JAWA BARAT","Kota Bandung, Sukaraja, Cicendo, Bandung, Jawa Barat, 40514, Indonesia","(-6.8901642, 107.5589157, 0.0)",-6.8901642,107.5589157,0.0
1394,"ROKAN HULU,RIAU","Rokan Hulu, Riau, Indonesia","(0.8919457, 100.46651555651417, 0.0)",0.8919457,100.46651555651417,0.0
1395,"BANDUNG,JAWA BARAT","Jawa Barat, Cibiru, Cipadung Kidul, Panyileukan, Bandung, Jawa Barat, 40624, Indonesia","(-6.9342173, 107.7222573, 0.0)",-6.9342173,107.7222573,0.0
1396,"KOTA CIMAHI,JAWA BARAT","Jalan Kota Mas X, Cimahi, Jawa Barat, 40524, Indonesia","(-6.869595, 107.5395052, 0.0)",-6.869595,107.5395052,0.0
1397,"BANDUNG,JAWA BARAT","Jawa Barat, Cibiru, Cipadung Kidul, Panyileukan, Bandung, Jawa Barat, 40624, Indonesia","(-6.9342173, 107.7222573, 0.0)",-6.9342173,107.7222573,0.0
1398,"ACEH TENGGARA,ACEH","Aceh Tenggara, Aceh, 24651, Indonesia","(3.338797, 97.74564237389382, 0.0)",3.338797,97.74564237389382,0.0
1399,"GORONTALO UTARA,GORONTALO","Kantor Bupati Gorontalo Utara, Trans Sulawesi, Kwandang, Gorontalo, Indonesia","(0.790945, 122.8686599242071, 0.0)",0.790945,122.8686599242071,0.0
1400,"KOTA CIREBON,JAWA BARAT","KORAMIL KOTA CIREBON, Cirebon, Jawa Barat, Indonesia","(-6.7217655, 108.550211614333, 0.0)",-6.7217655,108.550211614333,0.0
1401,"CIREBON,JAWA BARAT","Cirebon, Jawa Barat, 45121, Indonesia","(-6.7137044, 108.5608483, 0.0)",-6.7137044,108.5608483,0.0
1402,"GORONTALO UTARA,GORONTALO","Kantor Bupati Gorontalo Utara, Trans Sulawesi, Kwandang, Gorontalo, Indonesia","(0.790945, 122.8686599242071, 0.0)",0.790945,122.8686599242071,0.0
1403,"BANYUMAS,JAWA TENGAH","Banyumas, Jawa Tengah, Indonesia","(-7.45507165, 109.11674648495966, 0.0)",-7.45507165,109.11674648495966,0.0
1404,"KEPULAUAN ANAMBAS,KEPULAUAN RIAU","Kepulauan Anambas, Kepulauan Riau, 29791, Indonesia","(2.93890105, 105.76025801074812, 0.0)",2.93890105,105.76025801074812,0.0
1405,"SAMPANG,JAWA TIMUR","Sampang, Jawa Timur, Indonesia","(-7.05781575, 113.25405409767842, 0.0)",-7.05781575,113.25405409767842,0.0
1406,"KUDUS,JAWA TENGAH","Kudus, Jawa Tengah, Indonesia","(-6.8170915, 110.838189, 0.0)",-6.8170915,110.838189,0.0
1407,"WAJO,SULAWESI SELATAN","Wajo, Makassar, Sulawesi Selatan, Indonesia","(-5.12469395, 119.41250685487663, 0.0)",-5.12469395,119.41250685487663,0.0
1408,"SERANG,BANTEN","Serang, Banten, Indonesia","(-6.10549695, 105.9884713457985, 0.0)",-6.10549695,105.9884713457985,0.0
1409,"BANYUMAS,JAWA TENGAH","Banyumas, Jawa Tengah, Indonesia","(-7.45507165, 109.11674648495966, 0.0)",-7.45507165,109.11674648495966,0.0
1410,"ROKAN HULU,RIAU","Rokan Hulu, Riau, Indonesia","(0.8919457, 100.46651555651417, 0.0)",0.8919457,100.46651555651417,0.0
1411,"PAMEKASAN,JAWA TIMUR","Pamekasan, Jawa Timur, Indonesia","(-7.1605439, 113.4826273, 0.0)",-7.1605439,113.4826273,0.0
1412,"ACEH TENGGARA,ACEH","Aceh Tenggara, Aceh, 24651, Indonesia","(3.338797, 97.74564237389382, 0.0)",3.338797,97.74564237389382,0.0
1413,"KOTA SEMARANG,JAWA TENGAH","Gang Kelapa Gading, Wates, Ngaliyan, Kota Semarang, RW 01, Wates, Ngaliyan, Semarang, Jawa Tengah, 50189, Indonesia","(-7.0197176, 110.3360514, 0.0)",-7.0197176,110.3360514,0.0
1414,"KENDAL,JAWA TENGAH","Kendal, Jawa Tengah, Indonesia","(-7.01909655, 110.13747567422602, 0.0)",-7.01909655,110.13747567422602,0.0
1415,"PATI,JAWA TENGAH","Pati, Jawa Tengah, Indonesia","(-6.707092449999999, 111.08700759039746, 0.0)",-6.707092449999999,111.08700759039746,0.0
1416,"KOTA MAKASSAR,SULAWESI SELATAN","Jalan Balai Kota, Baru, Ujung Pandang, Makassar, Sulawesi Selatan, 90171, Indonesia","(-5.1347721, 119.4083565, 0.0)",-5.1347721,119.4083565,0.0
1417,"ACEH TENGGARA,ACEH","Aceh Tenggara, Aceh, 24651, Indonesia","(3.338797, 97.74564237389382, 0.0)",3.338797,97.74564237389382,0.0
1418,"CILACAP,JAWA TENGAH","Cilacap, Jawa Tengah, Indonesia","(-7.46167105, 108.80461463117007, 0.0)",-7.46167105,108.80461463117007,0.0
1419,"GROBOGAN,JAWA TENGAH","Grobogan, Jawa Tengah, Indonesia","(-7.09809465, 110.89667670375852, 0.0)",-7.09809465,110.89667670375852,0.0
1420,"PANGKAJENE KEPULAUAN,SULAWESI SELATAN","Pangkajene, Pangkajene dan Kepulauan, Sulawesi Selatan, 90611, Indonesia","(-4.834493, 119.5471569, 0.0)",-4.834493,119.5471569,0.0
1421,"MERAUKE,PAPUA","Merauke, Maro, Merauke, Papua, 9961, Indonesia","(-8.4902766, 140.395582, 0.0)",-8.4902766,140.395582,0.0
1422,"CIREBON,JAWA BARAT","Cirebon, Jawa Barat, 45121, Indonesia","(-6.7137044, 108.5608483, 0.0)",-6.7137044,108.5608483,0.0
1423,"BLORA,JAWA TENGAH","Blora, Jawa Tengah, 58211 - 58219, Indonesia","(-7.11054465, 111.42035148693856, 0.0)",-7.11054465,111.42035148693856,0.0
1424,"SUMBAWA,NUSA TENGGARA BARAT","Pulau Sumbawa, Nusa Tenggara Barat, Indonesia","(-8.5949025, 117.27160682483327, 0.0)",-8.5949025,117.27160682483327,0.0
1425,"ROKAN HULU,RIAU","Rokan Hulu, Riau, Indonesia","(0.8919457, 100.46651555651417, 0.0)",0.8919457,100.46651555651417,0.0
1426,"PANGANDARAN,JAWA BARAT","Pangandaran, Jalan Tol, Pangandaran, Pananjung, Jawa Barat, 46396, Indonesia","(-7.6872621, 108.6531455, 0.0)",-7.6872621,108.6531455,0.0
1427,"REMBANG,JAWA TENGAH","Rembang, Jawa Tengah, Indonesia","(-6.76986355, 111.45567087811551, 0.0)",-6.76986355,111.45567087811551,0.0
1428,"KUDUS,JAWA TENGAH","Kudus, Jawa Tengah, Indonesia","(-6.8170915, 110.838189, 0.0)",-6.8170915,110.838189,0.0
1429,"KOTA TANJUNG BALAI,SUMATERA UTARA","Kota Tanjung Balai, Sumatera Utara, Indonesia","(2.97280325, 99.79461100229092, 0.0)",2.97280325,99.79461100229092,0.0
1430,"LOMBOK TIMUR,NUSA TENGGARA BARAT","Lombok Timur, Nusa Tenggara Barat, 83659, Indonesia","(-8.6330934, 116.5587704, 0.0)",-8.6330934,116.5587704,0.0
1431,"BANDUNG,JAWA BARAT","Jawa Barat, Cibiru, Cipadung Kidul, Panyileukan, Bandung, Jawa Barat, 40624, Indonesia","(-6.9342173, 107.7222573, 0.0)",-6.9342173,107.7222573,0.0
1432,"SUMBAWA,NUSA TENGGARA BARAT","Pulau Sumbawa, Nusa Tenggara Barat, Indonesia","(-8.5949025, 117.27160682483327, 0.0)",-8.5949025,117.27160682483327,0.0
1433,"PIDIE,ACEH","Pidie, Aceh, Indonesia","(5.1143002, 95.94128340121603, 0.0)",5.1143002,95.94128340121603,0.0
1434,"CIAMIS,JAWA BARAT","Ciamis, Jawa Barat, 46211, Indonesia","(-7.3266611, 108.3530952, 0.0)",-7.3266611,108.3530952,0.0
1435,"BIMA,NUSA TENGGARA BARAT","Kabupaten Bima, Nusa Tenggara Barat, 84171, Indonesia","(-8.5637593, 118.6719665, 0.0)",-8.5637593,118.6719665,0.0
1436,"KOTA SURAKARTA,JAWA TENGAH","Taman Kota Punggawan, Ketelan, Surakarta, Jawa Tengah, 57132, Indonesia","(-7.56455835, 110.8182743897866, 0.0)",-7.56455835,110.8182743897866,0.0
1437,"BATU BARA,SUMATERA UTARA","Batu Bara, Sumatera Utara, Indonesia","(3.5564885999999998, 99.62844660427132, 0.0)",3.5564885999999998,99.62844660427132,0.0
1438,"CILACAP,JAWA TENGAH","Cilacap, Jawa Tengah, Indonesia","(-7.46167105, 108.80461463117007, 0.0)",-7.46167105,108.80461463117007,0.0
1439,"PANGANDARAN,JAWA BARAT","Pangandaran, Jalan Tol, Pangandaran, Pananjung, Jawa Barat, 46396, Indonesia","(-7.6872621, 108.6531455, 0.0)",-7.6872621,108.6531455,0.0
1440,"ACEH TAMIANG,ACEH","Aceh Tamiang, Aceh, 24476, Indonesia","(4.212262450000001, 97.91471113604223, 0.0)",4.212262450000001,97.91471113604223,0.0
1441,"SUKOHARJO,JAWA TENGAH","Sukoharjo, Jawa Tengah, Indonesia","(-7.681572900000001, 110.86761323046875, 0.0)",-7.681572900000001,110.86761323046875,0.0
1442,"CILACAP,JAWA TENGAH","Cilacap, Jawa Tengah, Indonesia","(-7.46167105, 108.80461463117007, 0.0)",-7.46167105,108.80461463117007,0.0
1443,"NGANJUK,JAWA TIMUR","Kantor Kecamatan Dander, Bojonegoro, Jawa Timur, Jalan Raya Nganjuk - Bojonegoro, Dander, Bojonegoro, Jawa Timur, 62171, Indonesia","(-7.2505528, 111.8461202, 0.0)",-7.2505528,111.8461202,0.0
1444,"PURWOREJO,JAWA TENGAH","Purworejo, Jawa Tengah, Indonesia","(-7.7073021, 109.96651169154023, 0.0)",-7.7073021,109.96651169154023,0.0
1445,"MOJOKERTO,JAWA TIMUR","Mojokerto, Jawa Timur, Indonesia","(-7.54133775, 112.50949745736571, 0.0)",-7.54133775,112.50949745736571,0.0
1446,"ACEH TAMIANG,ACEH","Aceh Tamiang, Aceh, 24476, Indonesia","(4.212262450000001, 97.91471113604223, 0.0)",4.212262450000001,97.91471113604223,0.0
1447,"KOTA MALANG,JAWA TIMUR","Kota Malang, Jawa Timur, Indonesia","(-7.9771206, 112.6340291, 0.0)",-7.9771206,112.6340291,0.0
1448,"PURBALINGGA,JAWA TENGAH","Purbalingga, Jawa Tengah, Indonesia","(-7.32733005, 109.39989874266684, 0.0)",-7.32733005,109.39989874266684,0.0
1449,"GRESIK,JAWA TIMUR","Gresik, Jawa Timur, Indonesia","(-5.79334655, 112.6598223201143, 0.0)",-5.79334655,112.6598223201143,0.0
1450,"DOMPU,NUSA TENGGARA BARAT","Dompu, Nusa Tenggara Barat, Indonesia","(-8.5164771, 118.33121614464076, 0.0)",-8.5164771,118.33121614464076,0.0
1451,"LAMONGAN,JAWA TIMUR","Lamongan, Jawa Timur, Indonesia","(-7.1229318500000005, 112.32819354965417, 0.0)",-7.1229318500000005,112.32819354965417,0.0
1452,"ACEH JAYA,ACEH","Aceh Jaya, Aceh, Indonesia","(4.811484399999999, 95.70019149086998, 0.0)",4.811484399999999,95.70019149086998,0.0
1453,"PASURUAN,JAWA TIMUR","Pasuruan, Jawa Timur, Indonesia","(-7.6419894, 112.906694, 0.0)",-7.6419894,112.906694,0.0
1454,"KUDUS,JAWA TENGAH","Kudus, Jawa Tengah, Indonesia","(-6.8170915, 110.838189, 0.0)",-6.8170915,110.838189,0.0
1455,"ACEH SELATAN,ACEH","Aceh Selatan, Aceh, Indonesia","(3.0679790000000002, 97.4687714679478, 0.0)",3.0679790000000002,97.4687714679478,0.0
1456,"PATI,JAWA TENGAH","Pati, Jawa Tengah, Indonesia","(-6.707092449999999, 111.08700759039746, 0.0)",-6.707092449999999,111.08700759039746,0.0
1457,"BATU BARA,SUMATERA UTARA","Batu Bara, Sumatera Utara, Indonesia","(3.5564885999999998, 99.62844660427132, 0.0)",3.5564885999999998,99.62844660427132,0.0
1458,"KUDUS,JAWA TENGAH","Kudus, Jawa Tengah, Indonesia","(-6.8170915, 110.838189, 0.0)",-6.8170915,110.838189,0.0
1459,"LABUHAN BATU UTARA,SUMATERA UTARA","Labuhan Bilik, Labuhanbatu, Sumatera Utara, Indonesia","(2.514607, 100.1703718, 0.0)",2.514607,100.1703718,0.0
1460,"CILACAP,JAWA TENGAH","Cilacap, Jawa Tengah, Indonesia","(-7.46167105, 108.80461463117007, 0.0)",-7.46167105,108.80461463117007,0.0
1461,"KOTA TEGAL,JAWA TENGAH","Alun-alun Kota Tegal, Tegal, Jawa Tengah, Indonesia","(-6.8674216999999995, 109.13791323125, 0.0)",-6.8674216999999995,109.13791323125,0.0
1462,"SAMPANG,JAWA TIMUR","Sampang, Jawa Timur, Indonesia","(-7.05781575, 113.25405409767842, 0.0)",-7.05781575,113.25405409767842,0.0
1463,"ROKAN HULU,RIAU","Rokan Hulu, Riau, Indonesia","(0.8919457, 100.46651555651417, 0.0)",0.8919457,100.46651555651417,0.0
1464,"BANGKALAN,JAWA TIMUR","Bangkalan, Jawa Timur, Indonesia","(-7.04637245, 112.89625027008556, 0.0)",-7.04637245,112.89625027008556,0.0
1465,"EMPAT LAWANG,SUMATERA SELATAN","Empat Lawang, Sumatera Selatan, Indonesia","(-3.7154833, 102.93247238633131, 0.0)",-3.7154833,102.93247238633131,0.0
1466,"LIMA PULUH KOTA,SUMATERA BARAT","Lima Puluh Kota, Sumatera Barat, Indonesia","(-0.0041436, 100.55927144934105, 0.0)",-0.0041436,100.55927144934105,0.0
1467,"BERAU,KALIMANTAN TIMUR","BERAU, Jalan Sultan Agung, Sungai Bedungun, Kalimantan Timur, 77311, Indonesia","(2.1488862, 117.4534366, 0.0)",2.1488862,117.4534366,0.0
1468,"PATI,JAWA TENGAH","Pati, Jawa Tengah, Indonesia","(-6.707092449999999, 111.08700759039746, 0.0)",-6.707092449999999,111.08700759039746,0.0
1469,"KUDUS,JAWA TENGAH","Kudus, Jawa Tengah, Indonesia","(-6.8170915, 110.838189, 0.0)",-6.8170915,110.838189,0.0
1470,"PANDEGLANG,BANTEN","Pandeglang, Banten, 42217, Indonesia","(-6.3097661, 106.1067474, 0.0)",-6.3097661,106.1067474,0.0
1471,"JEPARA,JAWA TENGAH","Jepara, Jawa Tengah, Indonesia","(-6.5906502, 110.6673202, 0.0)",-6.5906502,110.6673202,0.0
1472,"BATU BARA,SUMATERA UTARA","Batu Bara, Sumatera Utara, Indonesia","(3.5564885999999998, 99.62844660427132, 0.0)",3.5564885999999998,99.62844660427132,0.0
1473,"KOTA LHOKSEUMAWE,ACEH","Mesjid Syuhada Kampung Jawa lama,Kota lhokseumawe, Jalan Samudera, Banda Sakti, Lhokseumawe, Aceh, 24351, Indonesia","(5.1856789, 97.1486472, 0.0)",5.1856789,97.1486472,0.0
1474,"SUBANG,JAWA BARAT","Subang, Jawa Barat, Indonesia","(-6.5689807, 107.7587397, 0.0)",-6.5689807,107.7587397,0.0
1475,"SIDOARJO,JAWA TIMUR","Sidoarjo, Jawa Timur, Indonesia","(-7.45597405, 112.66088771295344, 0.0)",-7.45597405,112.66088771295344,0.0
1476,"KOTA JAKARTA TIMUR,DKI JAKARTA","Taman Kota Pondok Ranggon, Pondok Ranggon, Cipayung, Jakarta Timur, Daerah Khusus Ibukota Jakarta, Indonesia","(-6.353425550000001, 106.90747419804707, 0.0)",-6.353425550000001,106.90747419804707,0.0
1477,"LABUHAN BATU UTARA,SUMATERA UTARA","Labuhan Bilik, Labuhanbatu, Sumatera Utara, Indonesia","(2.514607, 100.1703718, 0.0)",2.514607,100.1703718,0.0
1478,"LANGKAT,SUMATERA UTARA","Langkat, Sumatera Utara, Indonesia","(3.8290501, 98.24827397454335, 0.0)",3.8290501,98.24827397454335,0.0
1479,"KOTA JAKARTA SELATAN,DKI JAKARTA","Hutan Kota Pondok Labu, Pondok Labu, Cilandak, Jakarta Selatan, Daerah Khusus Ibukota Jakarta, Indonesia","(-6.31023725, 106.79956109889318, 0.0)",-6.31023725,106.79956109889318,0.0
1480,"BOGOR,JAWA BARAT","Bogor, Jawa Barat, 16121, Indonesia","(-6.5962986, 106.7972421, 0.0)",-6.5962986,106.7972421,0.0
1481,"SAMPANG,JAWA TIMUR","Sampang, Jawa Timur, Indonesia","(-7.05781575, 113.25405409767842, 0.0)",-7.05781575,113.25405409767842,0.0
1482,"INDRAMAYU,JAWA BARAT","Indramayu, Kabupaten Indramayu, Jawa Barat, 45211, Indonesia","(-6.326433, 108.3229169, 0.0)",-6.326433,108.3229169,0.0
1483,"SERANG,BANTEN","Serang, Banten, Indonesia","(-6.10549695, 105.9884713457985, 0.0)",-6.10549695,105.9884713457985,0.0
1484,"LEBAK,BANTEN","Lebak, Banten, Indonesia","(-6.6432601, 106.18727177777018, 0.0)",-6.6432601,106.18727177777018,0.0
1485,"KARANGANYAR,JAWA TENGAH","Karanganyar, Jawa Tengah, Indonesia","(-7.6196965, 111.06980026754411, 0.0)",-7.6196965,111.06980026754411,0.0
1486,"SIMEULUE,ACEH","Simeulue, Aceh, 23891, Indonesia","(2.6290312, 96.02207792472555, 0.0)",2.6290312,96.02207792472555,0.0
1487,"MADIUN,JAWA TIMUR","Madiun, Jawa Timur, Indonesia","(-7.61188765, 111.67319262808837, 0.0)",-7.61188765,111.67319262808837,0.0
1488,"BATU BARA,SUMATERA UTARA","Batu Bara, Sumatera Utara, Indonesia","(3.5564885999999998, 99.62844660427132, 0.0)",3.5564885999999998,99.62844660427132,0.0
1489,"NGANJUK,JAWA TIMUR","Kantor Kecamatan Dander, Bojonegoro, Jawa Timur, Jalan Raya Nganjuk - Bojonegoro, Dander, Bojonegoro, Jawa Timur, 62171, Indonesia","(-7.2505528, 111.8461202, 0.0)",-7.2505528,111.8461202,0.0
1490,"KOTA SUBULUSSALAM,ACEH","Kota Subulussalam, Mertak Tombok, Kabupaten Lombok Tengah, Nusa Tenggara Barat, 83511, Indonesia","(-8.6813202, 116.2828, 0.0)",-8.6813202,116.2828,0.0
1491,"SIDOARJO,JAWA TIMUR","Sidoarjo, Jawa Timur, Indonesia","(-7.45597405, 112.66088771295344, 0.0)",-7.45597405,112.66088771295344,0.0
1492,"KOTA TEBING TINGGI,SUMATERA UTARA","Kota Tebing Tinggi, Sumatera Utara, Indonesia","(3.3280819, 99.15652857678585, 0.0)",3.3280819,99.15652857678585,0.0
1493,"CILACAP,JAWA TENGAH","Cilacap, Jawa Tengah, Indonesia","(-7.46167105, 108.80461463117007, 0.0)",-7.46167105,108.80461463117007,0.0
1494,"BATU BARA,SUMATERA UTARA","Batu Bara, Sumatera Utara, Indonesia","(3.5564885999999998, 99.62844660427132, 0.0)",3.5564885999999998,99.62844660427132,0.0
1495,"ACEH TIMUR,ACEH","Aceh Timur, Aceh, Indonesia","(4.70166295, 97.64503901995158, 0.0)",4.70166295,97.64503901995158,0.0
1496,"LANGKAT,SUMATERA UTARA","Langkat, Sumatera Utara, Indonesia","(3.8290501, 98.24827397454335, 0.0)",3.8290501,98.24827397454335,0.0
1497,"TUBAN,JAWA TIMUR","Tuban, Jawa Timur, Indonesia","(-6.959638549999999, 111.89322471121565, 0.0)",-6.959638549999999,111.89322471121565,0.0
1498,"ASAHAN,SUMATERA UTARA","Asahan, Sumatera Utara, 21211, Indonesia","(3.0963433, 99.8905262468976, 0.0)",3.0963433,99.8905262468976,0.0
1499,"DELI SERDANG,SUMATERA UTARA","Deli Serdang, Sumatera Utara, Indonesia","(3.6947182, 98.83100147255647, 0.0)",3.6947182,98.83100147255647,0.0
1500,"BANYUMAS,JAWA TENGAH","Banyumas, Jawa Tengah, Indonesia","(-7.45507165, 109.11674648495966, 0.0)",-7.45507165,109.11674648495966,0.0
1501,"PENUKAL ABAB LEMATANG ILIR,SUMATERA SELATAN","Penukal Abab Lematang Ilir, Sumatera Selatan, Indonesia","(-3.21399505, 104.0076940890376, 0.0)",-3.21399505,104.0076940890376,0.0
1502,"KOTA SERANG,BANTEN","Gedung Bersama Pemerintah Kota Serang, Sumurpecung, Serang, Banten, Indonesia","(-6.1198729, 106.17372743877546, 0.0)",-6.1198729,106.17372743877546,0.0
1503,"SERANG,BANTEN","Serang, Banten, Indonesia","(-6.10549695, 105.9884713457985, 0.0)",-6.10549695,105.9884713457985,0.0
1504,"LEBAK,BANTEN","Lebak, Banten, Indonesia","(-6.6432601, 106.18727177777018, 0.0)",-6.6432601,106.18727177777018,0.0
1505,"KOTA BINJAI,SUMATERA UTARA","Kota Binjai, Sumatera Utara, Indonesia","(3.5999998499999997, 98.48962252562653, 0.0)",3.5999998499999997,98.48962252562653,0.0
1506,"BATU BARA,SUMATERA UTARA","Batu Bara, Sumatera Utara, Indonesia","(3.5564885999999998, 99.62844660427132, 0.0)",3.5564885999999998,99.62844660427132,0.0
1507,"PURBALINGGA,JAWA TENGAH","Purbalingga, Jawa Tengah, Indonesia","(-7.32733005, 109.39989874266684, 0.0)",-7.32733005,109.39989874266684,0.0
1508,"KOTA MEDAN,SUMATERA UTARA","Kota Medan, Sumatera Utara, Indonesia","(3.5896654, 98.6738261, 0.0)",3.5896654,98.6738261,0.0
1509,"KOTA PRABUMULIH,SUMATERA SELATAN","Taman Kota Prabumulih, Prabumulih Timur, Prabumulih, Sumatera Selatan, Indonesia","(-3.41847155, 104.2464261677157, 0.0)",-3.41847155,104.2464261677157,0.0
1510,"ACEH UTARA,ACEH","Aceh Utara, Aceh, Indonesia","(4.99119405, 97.1587368058996, 0.0)",4.99119405,97.1587368058996,0.0
1511,"KOTA SEMARANG,JAWA TENGAH","Gang Kelapa Gading, Wates, Ngaliyan, Kota Semarang, RW 01, Wates, Ngaliyan, Semarang, Jawa Tengah, 50189, Indonesia","(-7.0197176, 110.3360514, 0.0)",-7.0197176,110.3360514,0.0
1512,"BANYUMAS,JAWA TENGAH","Banyumas, Jawa Tengah, Indonesia","(-7.45507165, 109.11674648495966, 0.0)",-7.45507165,109.11674648495966,0.0
1513,"PURBALINGGA,JAWA TENGAH","Purbalingga, Jawa Tengah, Indonesia","(-7.32733005, 109.39989874266684, 0.0)",-7.32733005,109.39989874266684,0.0
1514,"TABALONG,KALIMANTAN SELATAN","Tabalong, Kalimantan Selatan, Indonesia","(-1.8311413, 115.51783421937628, 0.0)",-1.8311413,115.51783421937628,0.0
1515,"JOMBANG,JAWA TIMUR","Jombang, Jawa Timur, 61417, Indonesia","(-7.5384528, 112.2379884, 0.0)",-7.5384528,112.2379884,0.0
1516,"KOTA SEMARANG,JAWA TENGAH","Gang Kelapa Gading, Wates, Ngaliyan, Kota Semarang, RW 01, Wates, Ngaliyan, Semarang, Jawa Tengah, 50189, Indonesia","(-7.0197176, 110.3360514, 0.0)",-7.0197176,110.3360514,0.0
1517,"BOJONEGORO,JAWA TIMUR","SMP Negeri 1 Dander, Bojonegoro, Jawa Timur, KM 15, Jalan Sumberarum, Sumberarum, Bojonegoro, Jawa Timur, 62171, Indonesia","(-7.2657534, 111.8665345, 0.0)",-7.2657534,111.8665345,0.0
1518,"BOJONEGORO,JAWA TIMUR","SMP Negeri 1 Dander, Bojonegoro, Jawa Timur, KM 15, Jalan Sumberarum, Sumberarum, Bojonegoro, Jawa Timur, 62171, Indonesia","(-7.2657534, 111.8665345, 0.0)",-7.2657534,111.8665345,0.0
1519,"BANJARNEGARA,JAWA TENGAH","Banjarnegara, Jawa Tengah, Indonesia","(-7.355873300000001, 109.66007275599358, 0.0)",-7.355873300000001,109.66007275599358,0.0
1520,"KOTA SAMARINDA,KALIMANTAN TIMUR","Hutan Kota, Samarinda, Kalimantan Timur, Indonesia","(-0.48992990000000003, 117.14742157928646, 0.0)",-0.48992990000000003,117.14742157928646,0.0
1521,"CILACAP,JAWA TENGAH","Cilacap, Jawa Tengah, Indonesia","(-7.46167105, 108.80461463117007, 0.0)",-7.46167105,108.80461463117007,0.0
1522,"BREBES,JAWA TENGAH","Brebes, Jawa Tengah, Indonesia","(-7.05207115, 108.88813597074842, 0.0)",-7.05207115,108.88813597074842,0.0
1523,"BOJONEGORO,JAWA TIMUR","SMP Negeri 1 Dander, Bojonegoro, Jawa Timur, KM 15, Jalan Sumberarum, Sumberarum, Bojonegoro, Jawa Timur, 62171, Indonesia","(-7.2657534, 111.8665345, 0.0)",-7.2657534,111.8665345,0.0
1524,"MUSI BANYU ASIN,SUMATERA SELATAN","PT Musi Banyu Asin, Jalan Blabak, RW 08, Ilir Timur II, Palembang, Sumatera Selatan, 30117, Indonesia","(-2.9802207000000003, 104.78620195148719, 0.0)",-2.9802207000000003,104.78620195148719,0.0
1525,"ASAHAN,SUMATERA UTARA","Asahan, Sumatera Utara, 21211, Indonesia","(3.0963433, 99.8905262468976, 0.0)",3.0963433,99.8905262468976,0.0
1526,"CIREBON,JAWA BARAT","Cirebon, Jawa Barat, 45121, Indonesia","(-6.7137044, 108.5608483, 0.0)",-6.7137044,108.5608483,0.0
1527,"MUARA ENIM,SUMATERA SELATAN","Muara Enim, Sumatera Selatan, Indonesia","(-3.84670675, 103.96157194770801, 0.0)",-3.84670675,103.96157194770801,0.0
1528,"TUBAN,JAWA TIMUR","Tuban, Jawa Timur, Indonesia","(-6.959638549999999, 111.89322471121565, 0.0)",-6.959638549999999,111.89322471121565,0.0
1529,"CILACAP,JAWA TENGAH","Cilacap, Jawa Tengah, Indonesia","(-7.46167105, 108.80461463117007, 0.0)",-7.46167105,108.80461463117007,0.0
1530,"REMBANG,JAWA TENGAH","Rembang, Jawa Tengah, Indonesia","(-6.76986355, 111.45567087811551, 0.0)",-6.76986355,111.45567087811551,0.0
1531,"KOTA BENGKULU,BENGKULU","Kota Pagu, Bengkulu, Indonesia","(-3.4006175, 102.5540614, 0.0)",-3.4006175,102.5540614,0.0
1532,"KUDUS,JAWA TENGAH","Kudus, Jawa Tengah, Indonesia","(-6.8170915, 110.838189, 0.0)",-6.8170915,110.838189,0.0
1533,"BATANGHARI,JAMBI","Jalan Batanghari II - Zona Lima, Taman Rajo, Jambi, Indonesia","(-1.428308, 103.6513925, 0.0)",-1.428308,103.6513925,0.0
1534,"BOJONEGORO,JAWA TIMUR","SMP Negeri 1 Dander, Bojonegoro, Jawa Timur, KM 15, Jalan Sumberarum, Sumberarum, Bojonegoro, Jawa Timur, 62171, Indonesia","(-7.2657534, 111.8665345, 0.0)",-7.2657534,111.8665345,0.0
1535,"BLORA,JAWA TENGAH","Blora, Jawa Tengah, 58211 - 58219, Indonesia","(-7.11054465, 111.42035148693856, 0.0)",-7.11054465,111.42035148693856,0.0
1536,"DOMPU,NUSA TENGGARA BARAT","Dompu, Nusa Tenggara Barat, Indonesia","(-8.5164771, 118.33121614464076, 0.0)",-8.5164771,118.33121614464076,0.0
1537,"KOTA TEBING TINGGI,SUMATERA UTARA","Kota Tebing Tinggi, Sumatera Utara, Indonesia","(3.3280819, 99.15652857678585, 0.0)",3.3280819,99.15652857678585,0.0
1538,"KOTA BITUNG,SULAWESI UTARA","Pintu Kota, Sulawesi Utara, Indonesia","(1.45528, 125.2554532, 0.0)",1.45528,125.2554532,0.0
1539,"TABALONG,KALIMANTAN SELATAN","Tabalong, Kalimantan Selatan, Indonesia","(-1.8311413, 115.51783421937628, 0.0)",-1.8311413,115.51783421937628,0.0
1540,"HULU SUNGAI TENGAH,KALIMANTAN SELATAN","Hulu Sungai Tengah, Kalimantan Selatan, Indonesia","(-2.6187576999999997, 115.42929968958293, 0.0)",-2.6187576999999997,115.42929968958293,0.0
1541,"SUMBAWA,NUSA TENGGARA BARAT","Pulau Sumbawa, Nusa Tenggara Barat, Indonesia","(-8.5949025, 117.27160682483327, 0.0)",-8.5949025,117.27160682483327,0.0
1542,"KOTAWARINGIN TIMUR,KALIMANTAN TENGAH","MTSN 2 KOTAWARINGIN TIMUR, Samuda Kecil, Kalimantan Tengah, 74363, Indonesia","(-2.8383962499999997, 112.96825492706611, 0.0)",-2.8383962499999997,112.96825492706611,0.0
1543,"SERUYAN,KALIMANTAN TENGAH","Sungai Seruyan, Kalimantan Tengah, Indonesia","(-3.2638614, 112.4966105, 0.0)",-3.2638614,112.4966105,0.0
1544,"BALANGAN,KALIMANTAN SELATAN","Balangan, Kalimantan Selatan, Indonesia","(-2.28789725, 115.62054766845205, 0.0)",-2.28789725,115.62054766845205,0.0
1545,"TAPIN,KALIMANTAN SELATAN","Tapin, Kalimantan Selatan, Indonesia","(-2.8622729500000004, 115.01096398201116, 0.0)",-2.8622729500000004,115.01096398201116,0.0
1546,"PENAJAM PASER UTARA,KALIMANTAN TIMUR","Kel. Penajam, Kalimantan Timur, 76141, Indonesia","(-1.2448547, 116.7759615, 0.0)",-1.2448547,116.7759615,0.0
1547,"SERDANG BEDAGAI,SUMATERA UTARA","Serdang Bedagai, Sumatera Utara, Indonesia","(3.5931148, 99.15833092741082, 0.0)",3.5931148,99.15833092741082,0.0
1548,"ROKAN HULU,RIAU","Rokan Hulu, Riau, Indonesia","(0.8919457, 100.46651555651417, 0.0)",0.8919457,100.46651555651417,0.0
1549,"MUSI BANYU ASIN,SUMATERA SELATAN","PT Musi Banyu Asin, Jalan Blabak, RW 08, Ilir Timur II, Palembang, Sumatera Selatan, 30117, Indonesia","(-2.9802207000000003, 104.78620195148719, 0.0)",-2.9802207000000003,104.78620195148719,0.0
1550,"PESISIR SELATAN,SUMATERA BARAT","DPC Partai Demokrat Pesisir Selatan, Jalan Raya Air Haji - Painan, Painan, Sumatera Barat, 25354, Indonesia","(-1.3486632, 100.5742238, 0.0)",-1.3486632,100.5742238,0.0
1551,"TASIKMALAYA,JAWA BARAT","Tasikmalaya, Jawa Barat, 46131, Indonesia","(-7.3262484, 108.2201154, 0.0)",-7.3262484,108.2201154,0.0
1552,"SAROLANGUN,JAMBI","Sarolangun, Jambi, 37481, Indonesia","(-2.3312458, 102.62753289964513, 0.0)",-2.3312458,102.62753289964513,0.0
1553,"TEBO,JAMBI","Tebo Ulu, Jambi, Indonesia","(-1.2383438, 102.238276, 0.0)",-1.2383438,102.238276,0.0
1554,"MALINAU,KALIMANTAN UTARA","Malinau, Kalimantan Utara, 77554, Indonesia","(2.6185545, 115.69049695186618, 0.0)",2.6185545,115.69049695186618,0.0
